[
  {
    "suggestion_id": "S01",
    "idea_id": "idea_client_kyc",
    "kind": "add_integration",
    "target_refs": [
      "/nodes/node_request_docs"
    ],
    "title": "Send the document request through the client portal",
    "change_summary": "An agent sends the checklist through the existing client portal as soon as the client record is created, and documents come back there instead of by email.",
    "rationale": "Documents are gathered by email today, and the portal already exists but isn't used for KYC.",
    "evidence": [
      {
        "source_id": "src_intake_is_client_kyc",
        "locator": "T10",
        "excerpt": "We have a client portal but don't use it for KYC yet"
      },
      {
        "source_id": "src_intake_is_client_kyc",
        "locator": "T0",
        "excerpt": "gathers ID documents by email"
      }
    ],
    "benefit": {
      "minutes_saved_per_case": 10,
      "cases_per_month": 150,
      "hours_saved_per_month": 25.0
    },
    "controls": "None needed: the request uses an approved template.",
    "risk": "Clients unused to the portal may need a one-off email with the link.",
    "confidence": 0.85,
    "status": "accepted",
    "decision": {
      "by": "user_sarah_lin",
      "at": "2026-10-05T13:46:00Z"
    },
    "ops": [
      {
        "op": "add",
        "path": "/nodes/node_request_docs/change",
        "value": {
          "kind": "automated",
          "suggestion_id": "S01",
          "was": "human_task"
        }
      },
      {
        "op": "replace",
        "path": "/nodes/node_request_docs/system_ids/0",
        "value": "act_client_portal"
      },
      {
        "op": "replace",
        "path": "/nodes/node_request_docs/description",
        "value": "Send the KYC document request to the new client through the client portal."
      },
      {
        "op": "add",
        "path": "/nodes/node_request_docs/meta/provenance/4",
        "value": {
          "source_id": "src_improve_is_client_kyc",
          "locator": {
            "kind": "suggestion",
            "value": "S01"
          },
          "excerpt": "Send the document request through the client portal",
          "stance": "supports",
          "extraction_certainty": 0.9
        }
      },
      {
        "op": "replace",
        "path": "/nodes/node_request_docs/hitl/mode",
        "value": "automated"
      },
      {
        "op": "replace",
        "path": "/nodes/node_await_docs/system_ids/0",
        "value": "act_client_portal"
      },
      {
        "op": "remove",
        "path": "/nodes/node_await_docs/system_ids/1"
      },
      {
        "op": "replace",
        "path": "/actors/act_client_portal/description",
        "value": "Client portal; used for KYC document requests and uploads."
      }
    ]
  },
  {
    "suggestion_id": "S02",
    "idea_id": "idea_client_kyc",
    "kind": "automate_step",
    "target_refs": [
      "/nodes/node_chase_docs"
    ],
    "title": "Automate document reminders",
    "change_summary": "Reminders go out automatically through the portal on day 5 and every 3 working days after, stopping when documents arrive.",
    "rationale": "Chasing is the biggest single cost today: about 30 minutes of emails per client.",
    "evidence": [
      {
        "source_id": "src_intake_is_client_kyc",
        "locator": "T16",
        "excerpt": "chasing about 30 minutes per client in emails"
      }
    ],
    "benefit": {
      "minutes_saved_per_case": 30,
      "cases_per_month": 150,
      "hours_saved_per_month": 75.0
    },
    "controls": "Engagement Manager is still told after 10 working days (existing exception).",
    "risk": "Over-chasing a client who has replied by email; reminders stop on any upload.",
    "confidence": 0.9,
    "status": "accepted",
    "decision": {
      "by": "user_sarah_lin",
      "at": "2026-10-05T13:46:20Z"
    },
    "ops": [
      {
        "op": "add",
        "path": "/nodes/node_chase_docs/change",
        "value": {
          "kind": "automated",
          "suggestion_id": "S02",
          "was": "human_task"
        }
      },
      {
        "op": "replace",
        "path": "/nodes/node_chase_docs/description",
        "value": "Send the client a reminder on day 5, then every 3 working days until the documents arrive."
      },
      {
        "op": "replace",
        "path": "/nodes/node_chase_docs/system_ids/0",
        "value": "act_client_portal"
      },
      {
        "op": "add",
        "path": "/nodes/node_chase_docs/meta/provenance/3",
        "value": {
          "source_id": "src_improve_is_client_kyc",
          "locator": {
            "kind": "suggestion",
            "value": "S02"
          },
          "excerpt": "Automate document reminders",
          "stance": "supports",
          "extraction_certainty": 0.9
        }
      },
      {
        "op": "replace",
        "path": "/nodes/node_chase_docs/hitl/mode",
        "value": "automated"
      }
    ]
  },
  {
    "suggestion_id": "S03",
    "idea_id": "idea_client_kyc",
    "kind": "automate_step",
    "target_refs": [
      "/nodes/node_verify_id"
    ],
    "title": "Verify IDs through the e-ID service API",
    "change_summary": "An agent submits each ID to the e-ID verification service automatically. Documents that fail go to an analyst's queue.",
    "rationale": "IDs are checked by hand on the e-ID website today.",
    "evidence": [
      {
        "source_id": "src_intake_is_client_kyc",
        "locator": "T16",
        "excerpt": "Checking IDs by hand takes about 20 minutes"
      },
      {
        "source_id": "src_intake_is_client_kyc",
        "locator": "T10",
        "excerpt": "checks IDs on the e-ID verification website"
      }
    ],
    "benefit": {
      "minutes_saved_per_case": 20,
      "cases_per_month": 150,
      "hours_saved_per_month": 50.0
    },
    "controls": "Human queue: failed checks go to an Onboarding Analyst.",
    "risk": "Depends on the e-ID service offering an API (to confirm with James).",
    "confidence": 0.8,
    "status": "accepted",
    "decision": {
      "by": "user_sarah_lin",
      "at": "2026-10-05T13:46:50Z"
    },
    "ops": [
      {
        "op": "add",
        "path": "/nodes/node_verify_id/change",
        "value": {
          "kind": "automated",
          "suggestion_id": "S03",
          "was": "human_task"
        }
      },
      {
        "op": "add",
        "path": "/nodes/node_verify_id/exception_ids",
        "value": [
          "exc_id_check_failed"
        ]
      },
      {
        "op": "replace",
        "path": "/nodes/node_verify_id/description",
        "value": "Verify each identity document through the e-ID verification service API."
      },
      {
        "op": "add",
        "path": "/nodes/node_verify_id/meta/provenance/4",
        "value": {
          "source_id": "src_improve_is_client_kyc",
          "locator": {
            "kind": "suggestion",
            "value": "S03"
          },
          "excerpt": "Verify IDs through the e-ID service API",
          "stance": "supports",
          "extraction_certainty": 0.9
        }
      },
      {
        "op": "replace",
        "path": "/nodes/node_verify_id/hitl/mode",
        "value": "automated"
      },
      {
        "op": "add",
        "path": "/exceptions/exc_id_check_failed",
        "value": {
          "name": "ID check failed",
          "trigger": "The e-ID verification service cannot verify an identity document",
          "trigger_kind": "data_quality",
          "applies_to": [
            "node_verify_id"
          ],
          "handling": {
            "action": "manual_review",
            "notify_actor_id": "act_onboarding_analyst",
            "notes": "An analyst checks the document before the case moves on."
          },
          "meta": {
            "status": "confirmed",
            "confidence": 0.0,
            "provenance": [
              {
                "source_id": "src_improve_is_client_kyc",
                "locator": {
                  "kind": "suggestion",
                  "value": "S03"
                },
                "excerpt": "Verify IDs through the e-ID service API",
                "stance": "supports",
                "extraction_certainty": 0.9
              }
            ],
            "confirmed_by": "user_sarah_lin"
          }
        }
      }
    ]
  },
  {
    "suggestion_id": "S04",
    "idea_id": "idea_client_kyc",
    "kind": "automate_with_review",
    "target_refs": [
      "/nodes/node_screen"
    ],
    "title": "Screen automatically, analyst reviews possible matches",
    "change_summary": "An agent screens the client and every director in one batch through the screening tool's API. An analyst only reviews possible matches.",
    "rationale": "Screening takes about 25 minutes because every director is searched separately, and the tool has an API.",
    "evidence": [
      {
        "source_id": "src_intake_is_client_kyc",
        "locator": "T16",
        "excerpt": "screening about 25 because every director is searched separately"
      },
      {
        "source_id": "src_answer_q_intake_01",
        "locator": "James Patel, q_intake_01",
        "excerpt": "The screening tool has an API for single and batch checks"
      }
    ],
    "benefit": {
      "minutes_saved_per_case": 25,
      "cases_per_month": 150,
      "hours_saved_per_month": 62.5
    },
    "controls": "Human review: an Onboarding Analyst confirms or clears every possible match before the case moves on.",
    "risk": "The match-score threshold decides how many cases reach an analyst (needs setting).",
    "confidence": 0.85,
    "status": "accepted",
    "decision": {
      "by": "user_sarah_lin",
      "at": "2026-10-05T13:47:30Z"
    },
    "ops": [
      {
        "op": "add",
        "path": "/nodes/node_screen/change",
        "value": {
          "kind": "automated_with_review",
          "suggestion_id": "S04",
          "was": "human_task"
        }